<?xml version="1.0" encoding="UTF-8"?>
<!--
    Application based specifications to detect in-memory malware with 
    Unconventional attack techniques in HazelCast platform   
-->
<hz-specification
    xmlns:xsi="http://www.w3.org/2001/XMLSchema-instance"
    xsi:noNamespaceSchemaLocation="hz-schema.xsd">
    
    <hz-member>
        <max-members>4</max-members>
        <time-to-leave>10000</time-to-leave>
        <update-records>true</update-records>
        <read-all-records>false</read-all-records>
        <http-connections max="2" min="1"></http-connections>
    </hz-member>
  
    <hz-client>
       <check-ip>true</check-ip>
        <update-records>true</update-records>
        <read-all-records>false</read-all-records>
        <check-ip>true</check-ip>
        <update-records>true</update-records>
        <read-all-records>false</read-all-records>
    </hz-client>
</hz-specification>
